{
  "hookId": "post_edit_scope_check",
  "scanner": "hardcoded-credential-fallback-scan",
  "status": "finding",
  "exitCode": 1,
  "blocked": true,
  "reason": "hardcoded credential fallback found",
  "inputsUsed": ["repoRoot", "changedFiles"],
  "findings": [
    {
      "path": "hooks/claude/examples/runner-scan-fixtures/hardcoded-credential-finding/src/config.js",
      "line": 1,
      "rule": "hardcoded-credential-fallback",
      "detail": "hardcoded database URL matched /postgres://|postgresql://|mysql:///: const defaultDatabaseUrl = \"postgres://fixture:fixture@localhost:5432/boundary_kit\";"
    },
    {
      "path": "hooks/claude/examples/runner-scan-fixtures/hardcoded-credential-finding/src/config.js",
      "line": 1,
      "rule": "hardcoded-credential-fallback",
      "detail": "fallback credential behavior matched /defaultDatabaseUrl|DEFAULT_DATABASE_URL|DATABASE_URL ||/: const defaultDatabaseUrl = \"postgres://fixture:fixture@localhost:5432/boundary_kit\";"
    },
    {
      "path": "hooks/claude/examples/runner-scan-fixtures/hardcoded-credential-finding/src/config.js",
      "line": 4,
      "rule": "hardcoded-credential-fallback",
      "detail": "fallback credential behavior matched /defaultDatabaseUrl|DEFAULT_DATABASE_URL|DATABASE_URL ||/: return defaultDatabaseUrl;"
    }
  ]
}
