{
  "hookId": "post_edit_scope_check",
  "scanner": "legacy-surface-retention-scan",
  "status": "clear",
  "exitCode": 0,
  "blocked": false,
  "reason": "no stale public surface finding for declared inputs",
  "inputsUsed": [
    "repoRoot",
    "changedFiles",
    "staleTerms"
  ],
  "findings": []
}
