{
  "hookId": "completion_evidence_check",
  "scanner": "completion-evidence-gate-scan",
  "status": "clear",
  "exitCode": 0,
  "blocked": false,
  "reason": "no completion evidence finding for declared inputs",
  "inputsUsed": [
    "completionDraft",
    "commandLog",
    "finalGate"
  ],
  "findings": []
}
